Title,Price,Area,Address,description,table,Link
Mieszkanie z miejscem parkingowym centrum,2 100 zł,40 m²,Tarnów - 18 marca 2025,"Do wynajęcia wygodne mieszkanie w świetnie skomunikowanej dzielnicy  Tarnowa. 
Dodatkowo miejsce parkingowe!

Prezentowane mieszkanie znajduję się na pierwszym piętrze bardzo zadbanej kamienicy w świetnej lokalizacji w samym sercu dzielnicy Grabówka w Tarnowie. Kamienica kilka lat temu przeszła remont elewacji, oraz podwórka 

mieszkanie o powierzchni 40 m2, do którego przynależy piwnica 4m2  składa się z :
salonu z aneksem kuchennym ok. 18m2\ wyposażony w zmywarkę, kuchenka, lodówka, sypialnia 18m2
łazienka 4m2
długi balkon (służący do komunikacji mieszkania z klatką schodową)
dodatkowo część wspólna hall 
do dyspozycji kameralne podwórze z
wyznaczonym miejscem parkingowym na wyłączność 
Mieszkanie wynajmowane z wyposażeniem- jak na zdjęciach, lub według uznania opróżnione.

Media/ Opłaty:
Mieszkanie ogrzewane piecem gazowym 2-funkcyjnym Vaillant (piec wymieniony 5 lat temu)
Energia elektryczna, gaz płatne według zużycia
Czynsz 2100 zł. msc. w tym zaliczka na zimną wodę 2 osoby/wspólnota/ koszty zarządu/śmieci. Cena podlega negocjacji.

Wymagana kaucja zabezpieczająca.

Znakomita lokalizacja w najbliższym otoczeniu 100 metrów - szkoła podstawowa nr 15, przedszkole, Akademia Nauk Stosowanych (PWSZ) 600m, przychodnia 300 m,
Hala sportowa TOSiR, sieć popularnych sklepów, przystanek popularnej w Tarnowie linii autobusowej nr.9.

A to wszystko w cichym, wygodnym do życia i wciąż rozwijającym się otoczeniu!",PrywatneZwierzęta: TakWinda: NieParking: przynależne na ulicyPoziom: 1Umeblowane: TakRodzaj zabudowy: KamienicaPowierzchnia: 40 m²Liczba pokoi: 2 pokoje,https://www.olx.pl/oferta/mieszkanie-z-miejscem-parkingowym-centrum-CID3-ID14Ym9n.html?reason=extended_search_extended_distance
"Gumniska, 2-pokojowe, 32m2, II Piętro",1 350 zł,32 m²,Tarnów - 18 marca 2025,"Do wynajęcia przytulne umeblowane i wyposażone w sprzęt AGD/RTV mieszkanie o powierzchni 32m2, usytuowane na drugim piętrze w czteropiętrowym bloku, mieszczącym się przy ul. Gumniska w Tarnowie.

Mieszkanie składa się z dwóch pokoi, kuchni z oknem oraz łazienki z WC. Posiada ogrzewanie miejskie oraz c.c.w.

Czynsz z odstępnym wynosi 1350zł, dodatkowo są płatne media (prąd, woda, gaz) wg zużycia i śmieci wg ilości zamieszkałych osób.

Wymagana jest umowa najmu okazjonalnego oraz kaucja zabezpieczająca w wysokości 2700 zł.

Polecamy.

Niniejsza oferta nie stanowi oferty w rozumieniu Kodeksu Cywilnego, a dane w niej zawarte mają jedynie charakter informacyjny i mogą ulec zmianie.",FirmoweZwierzęta: NieWinda: NieParking: identyfikator do strefy płatnego parkowaniaPoziom: 2Umeblowane: TakRodzaj zabudowy: BlokPowierzchnia: 32 m²Liczba pokoi: 2 pokoje,https://www.olx.pl/oferta/gumniska-2-pokojowe-32m2-ii-pietro-CID3-ID14Ylxr.html?reason=extended_search_extended_distance
73 m² w centrum Tarnowa/2 pokoje /2 balkony/bezczynszowe,2 400 złdo negocjacji,73 m²,Tarnów - 17 marca 2025,"Do wynajęcia klimatyczne mieszkanie o powierzchni 73 m², usytuowane na 3. piętrze kamienicy w samym sercu Tarnowa, przy ul. Urszulańskiej.

Mieszkanie składa się z:
• przestronnego salonu połączonego z dużą, w pełni wyposażoną kuchnią,
• oddzielnej, nieprzechodniej sypialni,
• dużego holu,
• łazienki z prysznicem typu walk-in,
• dwóch balkonów – co stanowi rzadko spotykany atut w tego typu zabudowie.

Do dyspozycji mieszkańców również wewnętrzny ogródek, należący do kamienicy – miejsce na chwilę wytchnienia w środku miasta.

Standard i wyposażenie:
• Mieszkanie świeżo po remoncie – nowe okna, stylowa łazienka, dębowy parkiet
• Kuchnia w pełni wyposażona: zmywarka, lodówka, piekarnik, płyta gazowa, drewniany blat
• Częściowe umeblowanie: sofa, stolik kawowy, szafka RTV w salonie, rozkładana skórzana sofa w sypialni
• Ogrzewanie gazowe – piec dwufunkcyjny

Koszty:
• Czynsz najmu: 2400 zł/mies.
• Opłaty administracyjne: 80 zł/mies. (utrzymanie części wspólnych, wywóz śmieci)
• Media: prąd, gaz, woda – według zużycia (liczniki)

Warunki najmu:
• Umowa najmu okazjonalnego
• Minimum 12 miesięcy
• Kaucja: 3500 zł
• Mieszkanie dostępne od zaraz

Lokalizacja i otoczenie:
• Ścisłe centrum Tarnowa – ul. Urszulańska
• Wszystko w zasięgu spaceru: sklepy, targ warzywno-owocowy, restauracje, kawiarnie, Tarnowski Rynek
• Płatny parking pod kamienicą – po godzinie 18 miejsca dostępne nieodpłatnie. Całodobowo darmowa strefa ulicę dalej. 

Dlaczego warto?
To mieszkanie ma w niepowtarzalny klimat, przestrzeń, która daje oddech, światło w ciągu całego dnia i styl, który czuć od progu. Idealnie sprawdzi się dla osób pracujących z domu, szukających komfortu i jakości życia w centrum miasta.

Zapraszam do kontaktu. Ogłoszenie bezpośrednio od właściciela.",PrywatneZwierzęta: NieWinda: NiePoziom: 3Umeblowane: TakRodzaj zabudowy: KamienicaPowierzchnia: 73 m²Liczba pokoi: 2 pokojeCzynsz (dodatkowo): 80 zł,https://www.olx.pl/oferta/73-m-w-centrum-tarnowa-2-pokoje-2-balkony-bezczynszowe-CID3-ID14XLLP.html?reason=extended_search_extended_distance
Wynajme kawalerkę Tarnów,1 200 zł,29 m²,Tarnów - 17 marca 2025,"Do wynajęcia kawalerka o pow.użytkowej 29m3 w Tarnowie na ul. Klikowskiej. 
Mieszkanie usytuowane na parterze, przy bloku znajduje się parking, a w pobliżu mieści się kościół Miłosierdzia Bożego, sklep Spar oraz przystanek autobusowy. 
W mieszkaniu znajduje się:
•przedpokój: pojemna szafa lustrzana,
• przestronny pokój: pojemna szafa wraz z komodą TV.
• nowoczesna kuchnia: meble kuchenne, zlew, lodówka, kuchenka indukcyjna,piekarnik;
• łazienka: prysznic z głębokim brodzikiem, wc, umywalka, pralka, pojemna szafka kosmetyczna;
Miesięczny czynsz do spółdzielni mieszkaniowej wynosi  około 450 zł. Plus prąd wg. zużycia.
Odstępne 1.400 zł
Kaucja 2.400 zł",PrywatneZwierzęta: NieWinda: NieParking: przynależne na ulicyPoziom: ParterUmeblowane: TakRodzaj zabudowy: BlokPowierzchnia: 29 m²Liczba pokoi: KawalerkaCzynsz (dodatkowo): 450 zł,https://www.olx.pl/oferta/wynajme-kawalerke-tarnow-CID3-ID14XyyU.html?reason=extended_search_extended_distance
"Wynajmę mieszkanie, 35m2 od właściciela",1 600 zł,35 m²,Tarnów - 17 marca 2025,"Oferuję do wynajęcia mieszkanie w Tarnowie przy ul. Szpitalna 33. Jasne, komfortowe mieszkanie 35m2 składające się z salonu, kuchni, sypialni oraz łazienki. Lokal jest po generalnym remoncie, w pełni umeblowany i wyposażony w nowe meble oraz urządzenia AGD, takie jak: płyta indukcyjna, piekarnik, pralka, smart TV (internet/TV w cenie) oraz dwie duze szafy. Dodatkowo, mieszkanie posiada centralne ogrzewanie z sieci miejskiej.
Lokalizacja mieszkania jest idealna pod względem logistycznym, co zapewnia wygodny dostęp do komunikacji miejskiej oraz infrastruktury.
Koszty wynajmu wynoszą 1600 zł miesięcznie, plus czynsz najmu 600 zł. Pozostałe opłaty obejmują ogrzewanie MPEC, ciepłą i zimną wodę, wywóz odpadów oraz dodatkowo energię elektryczną - wg faktury z licznika. Mieszkanie nie posiada instalacji gazowej.
Wymagana kaucja zwrotna w wysokości 3000 zł. Oferta skierowana jest do osób niepalących i bez zwierząt. Wynajmę mieszkanie wyłącznie osobie wiarygodnej, po przeprowadzeniu weryfikacji.
Oferta jest bez pośredników, bez prowizji i dodatkowych opłat. Mieszkanie dostępne od zaraz.
Zainteresowanych proszę o kontakt.","PrywatneZwierzęta: NieWinda: NieParking: brak, przynależne na ulicyPoziom: 1Umeblowane: TakRodzaj zabudowy: BlokPowierzchnia: 35 m²Liczba pokoi: 2 pokojeCzynsz (dodatkowo): 600 zł",https://www.olx.pl/oferta/wynajme-mieszkanie-35m2-od-wlasciciela-CID3-ID14Xsug.html?reason=extended_search_extended_distance
mieszkanie 34m2 Tarnów ul. Elektryczna parter modernizowane w 2024r,1 300 zł,34 m²,Tarnów - Odświeżono dnia 16 marca 2025,"Do wynajęcia mieszkanie 2 pokojowe na parterze domu przy ul. Elektrycznej w Tarnowie o pow. 34m2 (usytuowane od strony południowej i zachodniej w budynku niedaleko ronda ulic Klikowska i Elektryczna)
Wejście bezpośrednio z tarasu lub z klatki schodowej bez pokonywania stopni
Mieszkanie jest po modernizacji w 2024roku.
Wyposażenie: zabudowa kuchenna, kuchenka 2 palnikowa, okap, zlew, pralka, szafki łazienkowe, prysznic, umywalka, półki ścienne
Możliwość wyjścia z budynku na taras przed ogrodem (strona południowa)
Możliwość zdemontowania półek ze ścian.
Możliwość zaparkowania samochodu.
Widok z okien na ogród i zieleń (okna usytuowane na południe i zachód)
Cicha i spokojna okolica. Od ul. Elektrycznej ekrany akustyczne.
Niedaleko do Parku Piaskówka.
Blisko do centrum (około 2km)
Opłaty za mieszkanie - odstępne 1300zł + media (woda, prąd, gaz)
Zwierzęta nie są akceptowane.
Kaucja 2600zł.
Umowa najmu sporządzona będzie w formie aktu notarialnego, którego koszt około 200zł poniesie Wynajmujący.
tel. 60********25",PrywatneZwierzęta: NieWinda: NiePoziom: ParterUmeblowane: NieRodzaj zabudowy: Dom wolnostojącyPowierzchnia: 34 m²Liczba pokoi: 2 pokoje,https://www.olx.pl/oferta/mieszkanie-34m2-tarnow-ul-elektryczna-parter-modernizowane-w-2024r-CID3-ID140uzp.html?reason=extended_search_extended_distance
Ekonomiczne mieszkanie blisko centrum,1 200 zł,49 m²,Tarnów - 16 marca 2025,"Wynajmę przyjemne i funkcjonalne mieszkanie przy ulicy Lelewela, trzecie piętro, 49 metrów.
2 pokoje, kuchnia, łazienka, przedpokój i balkon.
Blisko dworce, sklepy, szkoła, przedszkole, żłobek i centrum miasta. Pod blokiem parking. Serdeczni sąsiedzi.
Kuchnia wyposażona w lodówkę, kuchenkę gazową, piekarnik elektryczny i miły kącik ze stołem.
W całym mieszkaniu przestronne szafy i szafeczki. Możliwość wstawienia dodatkowych mebli.
Odstępne 1200 PLN + czynsz przy trzech osobach około 800 PLN + prąd i gaz.
Kaucja 1500 PLN
Umowa z najmem okazjonalnym.",PrywatneZwierzęta: TakWinda: NiePoziom: 3Umeblowane: TakRodzaj zabudowy: BlokPowierzchnia: 49 m²Liczba pokoi: 2 pokojeCzynsz (dodatkowo): 800 zł,https://www.olx.pl/oferta/ekonomiczne-mieszkanie-blisko-centrum-CID3-ID14ViZc.html?reason=extended_search_extended_distance
Westerplatte Tarnów 61m2 3 sypialnie,1 800 zł,61 m²,Tarnów - 16 marca 2025,"Do wynajęcia mieszkanie 61m2 bloku przy ul.Westerplatte 7 w Tarnowie. Trzy sypialnie w tym jedna z wyjściem na balkon. Kuchnia z jadalnią i salonikiem tworzą otwartą przestrzeń ok 22m2
Mieszknie na drugim pietrze w niskim bloku (10 mieszkań na klatce), z domofonem.
Mieszkanie odmalowane, umeblowana kuchnia: lodówka, kuchenka, piekarnik, okap, zmywarka. W łazience pralka. W mieszkaniu 3 pojemne szafy w zabudowie. Wyposażone tak jak na zdjęciach.
Opłaty: 1800zł odstepne plus czynsz 850zł/ 1 osoba. W czynszu ogrzewanie, ryczałt na wodę ciepłą i zimną, wywóz nieczystosci, gaz.
Dodatkowo płatna energia elektryczna. Ostatni lokatorzy płacili koszt za wszystko ok. 2800zl za 3 osoby.
Wymagana umowa najmu okazjonalnego. Najem bez zwierząt.
Kaucja zwrotna 3000zł.",PrywatneZwierzęta: NieWinda: NieParking: przynależne na ulicyPoziom: 2Umeblowane: TakRodzaj zabudowy: BlokPowierzchnia: 61 m²Liczba pokoi: 4 i więcejCzynsz (dodatkowo): 850 zł,https://www.olx.pl/oferta/westerplatte-tarnow-61m2-3-sypialnie-CID3-ID14V9d6.html?reason=extended_search_extended_distance
Kawalerka Centrum 1piętro,1 300 zł,26 m²,Tarnów - 15 marca 2025,"Od 1 Kwietnia do wynajęcia kawalerka znajdująca się na 1piętrze w samym centrum przy ul. Joachima Lelewela w Tarnowie. do dworca PKS i PKP 100m. przystanek pod blokiem, cukiernia, pasaż handlowy. Pokój z otwartą kuchnią + łazienka + piwnica. Świeżo po remoncie, umeblowane i wyposażone (dodatkowo szafka rtv, komoda której nie ma na zdjęciu) koszt:  1300zł + 400zł czynsz. Dodatkowo prąd wg zużycia. + Internet 30zł Bez zwierząt.  tel: 5*0*6*7*3*6*8*3*1",PrywatneZwierzęta: NieWinda: NieParking: identyfikator do strefy płatnego parkowaniaPoziom: 1Umeblowane: TakRodzaj zabudowy: BlokPowierzchnia: 26 m²Liczba pokoi: Kawalerka,https://www.olx.pl/oferta/kawalerka-centrum-1pietro-CID3-ID14WzB7.html?reason=extended_search_extended_distance
Wynajmę mieszkanie,1 600 zł,37 m²,Tarnów - 13 marca 2025,"Do wynajęcia mieszkanie w Tarnowie przy ul. Pułaskiego 99.
Mieszkanie znajduje się na pierwszym piętrze z balkonem. 
Częściowo umeblowane. Kuchnia i łazienka w pełni umeblowana, salon częściowo umeblowany.
Bez gazu.
Mieszkanie wolne od 01 maja 2025r.
Spokojna dzielnica, blisko do centrum miasta, sklepów i kościoła.
Cena wynajmu 1600,00 zł
Opłaty za media około 700,00 do 800,00 zł.",PrywatneWinda: NieParking: przynależne na ulicyPoziom: 1Umeblowane: TakRodzaj zabudowy: BlokPowierzchnia: 37 m²Liczba pokoi: KawalerkaCzynsz (dodatkowo): 700 zł,https://www.olx.pl/oferta/wynajme-mieszkanie-CID3-ID14TSJp.html?reason=extended_search_extended_distance
Mieszkanie 51m na ul. Sowińskiego,1 500 zł,51 m²,Tarnów - 13 marca 2025,"Witam,

Na wynajem mieszkanie na ulicy Sowińskiego o metrażu 51m^2. Mieszkanie składa się z pokoju, łazienki, kuchni oraz dużego przedpokoju.
Najem 1500zł
Czynsz administracyjny 200zł.

Dostępne od zaraz.

Zainteresowanych zapraszam do kontaktu 60*****50.",PrywatneUmeblowane: NieRodzaj zabudowy: KamienicaPowierzchnia: 51 m²Liczba pokoi: Kawalerka,https://www.olx.pl/oferta/mieszkanie-51m-na-ul-sowinskiego-CID3-ID14TwTn.html?reason=extended_search_extended_distance
"Ks. Reca, 1-pokojowe, 36,35m2, II piętro",1 400 zł,36 m²,Tarnów - 12 marca 2025,"Do wynajęcie przestronne jednopokojowe mieszkanie o powierzchni 36,35m2, usytuowane na drugim piętrze bloku, mieszczącego się przy ul. Ks. Reca w Tarnowie-Mościcach.

Mieszkanie składa się z nieumeblowanego pokoju, umeblowanej kuchni, łazienki z WC oraz korytarza.

Czynsz z odstępnym wynosi 1400 zł, dodatkowo płatne media: prąd, woda, gaz wg zużycia oraz śmieci wg ilości zamieszkałych osób. Posiada ogrzewanie miejskie.

Wymagana kaucja zabezpieczająca w wysokości 2800 zł.

Do dyspozycji najemcy bezpłatny parking koło bloku.

Bardzo dobra lokalizacja. W pobliży sklepy/supermarkety, szkoła, przedszkole, przystanki komunikacji, obiekty sportowe, tereny rekreacyjne miejskiej, przychodnia, Kościół, etc.

Polecamy.

Niniejsza oferta nie stanowi oferty w rozumieniu Kodeksu Cywilnego, a dane w niej zawarte mają jedynie charakter informacyjny i mogą ulec zmianie.",FirmoweWinda: NiePoziom: 2Umeblowane: TakRodzaj zabudowy: BlokPowierzchnia: 36 m²Liczba pokoi: Kawalerka,https://www.olx.pl/oferta/ks-reca-1-pokojowe-36-35m2-ii-pietro-CID3-ID14SqY3.html?reason=extended_search_extended_distance
Wynajme mieszkanie Tarnów Os. Niepodległości,1 500 zł,45 m²,Tarnów - 10 marca 2025,"Witam 
Wynajme mieszkanie 45metrow 
Mieszkanie znajduje się na os. Niepodległości 
Mieszkanie jest obecnie wynajmowane do 25marca 
Czynsz do spółdzielni około 600zl
Mieszkanie znajduje się na parterze 
Super lokalizacja
Odstępne 1500
Dostępne od 1 kwietnia 
Dodatkowo opłaty prąd i gaz",PrywatneWinda: NiePoziom: ParterUmeblowane: TakRodzaj zabudowy: BlokPowierzchnia: 45 m²Liczba pokoi: 2 pokojeCzynsz (dodatkowo): 600 zł,https://www.olx.pl/oferta/wynajme-mieszkanie-tarnow-os-niepodleglosci-CID3-ID14QJmS.html?reason=extended_search_extended_distance
Do wynajęcia mieszkanie 4 pokojowe przy ul. Słowackiego,1 500 złdo negocjacji,"73,80 m²",Tarnów - 09 marca 2025,"Wynajmę ładne, 4 pokojowe mieszkanie przy ulicy Słowackiego w Tarnowie. Mieszkanie usytuowane na parterze dwupiętrowego bloku. Mieszkanie składa się z czterech pokoi, kuchni, przedpokoju, łazienki i pralni. Mieszkanie czyste, zadbane. Ogrzewanie i ciepła woda z MPEC. Mieszkanie w bardzo dobrej lokalizacji, blisko centrum, bardzo dobrze skomunikowane. Blok ogrodzony usytuowany pośród domów jednorodzinnych, przydzielone miejsce parkingowe. Wynajem tylko dla osób niepalących, akceptowane małe zwierzęta. Wynajem na dłuższy okres. Koszt wynajmu: odstępne 1600 złotych + czynsz do spółdzielni uzależniony od ilości osób + prąd i gaz wg zużycia.
Wymagana kaucja zwrotna w wysokości 2500 złotych.
Mieszkanie dostępne od kwietnia
Forma wynajmu - najem okazjonalny
Wynajem bezpośrednio od właściciela. Pozostałe informację udzielam telefonicznie.
Zapraszam","PrywatneZwierzęta: TakWinda: NiePoziom: ParterUmeblowane: TakRodzaj zabudowy: BlokPowierzchnia: 73,80 m²Liczba pokoi: 4 i więcejCzynsz (dodatkowo): 1 300 zł",https://www.olx.pl/oferta/do-wynajecia-mieszkanie-4-pokojowe-przy-ul-slowackiego-CID3-ID14fEuX.html?reason=extended_search_extended_distance
Wynajmę mieszkanie w doskonałej lokalizacji,1 250 zł,28 m²,Tarnów - 09 marca 2025,"DOSKONAŁA LOKALIZACJA. Pierwsze piętro, obok Świtu. Do mieszkania przynależy piwnica. W pełni umeblowane. Nr tel. 66********39. 1250 odstępne  plus media i czynsz do spółdzielni(460 zł ). Kontakt wyłącznie telefoniczny.",PrywatneParking: brakPoziom: ParterUmeblowane: TakRodzaj zabudowy: BlokPowierzchnia: 28 m²Liczba pokoi: KawalerkaCzynsz (dodatkowo): 460 zł,https://www.olx.pl/oferta/wynajme-mieszkanie-w-doskonalej-lokalizacji-CID3-ID14OZz5.html?reason=extended_search_extended_distance
Rezerwacja-3 pokojowe mieszkanie z ogródkiem i miejscem parkingowym,2 000 zł,43 m²,Tarnów - 08 marca 2025,"Do wynajęcia mieszkanie położone na parterze nowego bloku.

Lokalizacja - ul. Św. Katarzyny - cicha okolica, blisko - Lidl, Galeria Tarnovia, szkoła, przedszkole.

Mieszkanie o powierzchni 43 m w skład którego wchodzi:

+ salon połączony z kuchnią i jadalnią, z wyjściem do ogródka: rozkładany stół z krzesłami, sofa, szafka pod TV,  kuchnia na zamówienie wyposażona w NOWY sprzęt AGD: płyta, zmywarka, okap, lodówka, piekarnik.

+ sypialnia z wyjściem do ogródka: szafa oraz duże łóżko z wbudowanym oświetleniem i szufladą, 

+ dodatkowy pokój: kanapa, doskonały jako pokój dziecięcy lub gabinet, wyjście na taras i do ogródka,

+ łazienka: kabina prysznicowa, pralka, pojemna zabudowa,

+ przedpokój: duża szafa z lustrem, pawlacz, szafka na buty.

Dodatkowe udogodnienia:
+ wyznaczone miejsce postojowe,
+ rolety zewnętrzne, 
+ ogrzewanie podłogowe, 
+ ogródek ok 75 metrów.

Czynsz najmu 2000 zł. Dodatkowo płatny czynsz administracyjny w wysokości ok. 200 zł, oraz media wg. zużycia prąd, gaz (ciepła woda i ogrzewanie podłogowe poprzez piec gazowy). 

Wymagana umowa najmu okazjonalnego.",PrywatnePoziom: ParterUmeblowane: TakRodzaj zabudowy: BlokPowierzchnia: 43 m²Liczba pokoi: 3 pokojeCzynsz (dodatkowo): 200 zł,https://www.olx.pl/oferta/rezerwacja-3-pokojowe-mieszkanie-z-ogrodkiem-i-miejscem-parkingowym-CID3-ID14OnOA.html?reason=extended_search_extended_distance
Mieszkanie do wynajęcia,1 500 złdo negocjacji,46 m²,Tarnów - 04 marca 2025,"Wynajmę mieszkanie 2 pokojowe o pow. 46,00m2, łazienka, kuchnia. Mieszkanie usytuowane jest na 3 piętrze w czteropiętrowym bloku. Mieszkanie jest w pełni umeblowane, znajdują się w nim liczne sprzęty RTV i AGD takie jak: telewizor, pralka, lodówka, zmywarka, mikrofalówka itp. Do mieszkania przynależy niewielka komórka w piwnicy.
Odstępne: 1500 zł + czynsz [ok 800zł przy 2 os., w tym jest: woda, centralne ogrzewanie, dodatkowo płatne: gaz, prąd, opłata za śmieci - zależnie od ilości osób] + media wg zużycia. 
Wymagana kaucja w wysokości 1500 zł.",PrywatneZwierzęta: NieWinda: NieParking: przynależne na ulicyPoziom: 3Umeblowane: TakRodzaj zabudowy: BlokPowierzchnia: 46 m²Liczba pokoi: 2 pokoje,https://www.olx.pl/oferta/mieszkanie-do-wynajecia-CID3-ID149AXD.html?reason=extended_search_extended_distance
"Krakowska, 3-pokojowe, 52m2, II piętro",1 250 zł,52 m²,Tarnów - 04 marca 2025,"Do wynajęcia nieumeblowane mieszkanie o powierzchni 52m2, usytuowane na drugim piętrze kamienicy mieszczącej się przy ul. Krakowskiej w Tarnowie.

Mieszkanie składa się z trzech pokoi, kuchni, korytarza oraz łazienki z WC. Posiada etażowe ogrzewanie gazowe piecem dwu-funkcyjnym.

Lokal mieszkalny został odświeżony (wymalowane ściany, nowe meble kuchenne oraz nowa wykładzina dywanowa).

Czynsz z odstępnym wynosi 1250 zł, do tego płatne są media wg zużycia oraz śmieci wg ilości zamieszkałych osób.

Wymagana jest kaucja zabezpieczająca w wysokości 2500 zł oraz umowa najmu okazjonalnego.

Polecamy.

Niniejsza oferta nie stanowi oferty w rozumieniu Kodeksu Cywilnego, a dane w niej zawarte mają jedynie charakter informacyjny i mogą ulec zmianie.",FirmoweZwierzęta: NieWinda: NiePoziom: 2Umeblowane: NieRodzaj zabudowy: KamienicaPowierzchnia: 52 m²Liczba pokoi: 3 pokoje,https://www.olx.pl/oferta/krakowska-3-pokojowe-52m2-ii-pietro-CID3-ID14cNrD.html?reason=extended_search_extended_distance
Wynajmę mieszkanie kawalerkę w centrum,1 750 zł,37 m²,Tarnów - 03 marca 2025,"Do wynajęcia mieszkanie o pow. 37m2 w centrum Tarnowa ul. Brodzińskiego 18.
Mieszkanie w pełni wyposażone:
-pralka
-lodówka
-kuchenka gazowa
-zmywarka
-piekarnik
Mieszkanie na parterze w centrum, 50m od uczelni, wejście od podwórza dzięki czemu jest cisza i spokój. Wszystkie media dostępne tj. internet, telewizja, prąd, gaz. Ogrzewanie piecem gazowym dwufunkcyjnym.
Dodatkowo wymagana kaucja zwrotna 2000 zł
Czynsz 250 zł
Dostępne od zaraz
Polecam",PrywatneZwierzęta: TakParking: brakPoziom: ParterUmeblowane: TakRodzaj zabudowy: KamienicaPowierzchnia: 37 m²Liczba pokoi: KawalerkaCzynsz (dodatkowo): 250 zł,https://www.olx.pl/oferta/wynajme-mieszkanie-kawalerke-w-centrum-CID3-ID14IZO6.html?reason=extended_search_extended_distance
"Mieszkanie na wynajem 2 pokoje Tarnów, ul. Szpitalna",1 800 zł,28 m²,Tarnów - 02 marca 2025,"Oferuję do wynajęcia mieszkanie po remoncie, na parterze, 2 pokojowe, w świetnej lokalizacji na ul. Szpitalnej przy Akademii Tarnowskiej i MWSE, idealne dla studentów. Więcej informacji udzielę telefonicznie pod numer 72*******50.
Cena: odstępne 1800zl + opłaty (czynsz 300 zł plus media wg zużycia)",PrywatneZwierzęta: NieWinda: NiePoziom: ParterUmeblowane: TakRodzaj zabudowy: BlokPowierzchnia: 28 m²Liczba pokoi: 2 pokoje,https://www.olx.pl/oferta/mieszkanie-na-wynajem-2-pokoje-tarnow-ul-szpitalna-CID3-ID14HX0A.html?reason=extended_search_extended_distance
Mieszkanie na wynajem - PARTER CENTRUM Tarnowa  Super Oferta,2 200 złdo negocjacji,48 m²,Tarnów - 02 marca 2025,"Do wynajęcia mieszkanie 48m2 w bloku 4 piętrowym na parterze na ul Pułaskiego w Tarnowie
Blok po termomodernizacji
Mieszkanie składa się z salonu z aneksem kuchennym, 2 pokoi, przedpokoju oraz łazienki z WC.
Do mieszkania przynależy piwnica oraz balkon francuski
Pełna infrastruktura (szkoła , przedszkole, żłobek, plac zabaw, sklepy spożywcze, dworzec PKP, komunikacja miejska, blisko do centrum miasta)
Cena 2200zł odstępnego (do negocjacji) + 430zł czynszu przy 0 osób zameldowanych + prąd.
Kaucja: 2500zł

Umowa najmu okazjonalnego
Przedstawiona oferta cenowa ma charakter informacyjny i nie stanowi oferty handlowej w rozumieniu Art.66 par.1 Kodeksu Cywilnego.

Jeśli podoba Ci się nasza oferta i jesteś zainteresowana/y mieszkaniem, koniecznie skontaktuj się z nami już teraz! 
Kontakt do opiekuna oferty:
Mirek
Przytulne M4 Biuro Nieruchomości
tel: +48**********87",PrywatneWinda: NieParking: przynależne na ulicyPoziom: ParterUmeblowane: TakRodzaj zabudowy: BlokPowierzchnia: 48 m²Liczba pokoi: 3 pokoje,https://www.olx.pl/oferta/mieszkanie-na-wynajem-parter-centrum-tarnowa-super-oferta-CID3-ID14HS6s.html?reason=extended_search_extended_distance
"Mieszkanie 2 pokojowe z balkonem, jasna kuchnia, 44 m, Tarnów Strusina",2 000 zł,44 m²,Tarnów - 27 lutego 2025,"Oferuję od 1 kwietnia (prywatnie) do długoterminowego wynajmu mieszkanie o pow. 44 m2 usytuowane na 1 piętrze bloku czteropiętrowego przy ul. Wiejskiej w Tarnowie. Okna na obie strony bloku. Balkon. 
Mieszkanie po wymianie instalacji elektrycznej i wodno-kanalizacyjnej, częściowo umeblowane. W kuchni (8,77 m) pralka, lodówka, płyta gazowa i okap oraz meble na wymiar.
Lokal składa się z dwóch pokoi, jasnej kuchni, łazienki z wc oraz przedpokoju. W większym pokoju (18,53 m) duża szafa w zabudowie, fotel, rozkładana sofa, stół i krzesła (możliwość jeszcze jednego łóżka 90x200 cm). W mniejszym (8,86 m) łóżko, regał z półami i zamykanymi szafkami oraz stolik nocny. W łazience wanna z zasuwanymi przeszkleniami (opcja prysznica), umywalka z szafką, toaleta, lustro z półką, szafka z koszem na pranie. W przedpokoju wieszaki, półka i 2 szafki w zabudowie. Przesuwne drzwi do pokojów i łazienki, kuchnia otwarta (bez drzwi).
Na podłogach panele oraz terakota. Do mieszkania przynależy piwnica, w bloku jest domofon, miejsca parkingowe przed budynkiem.
Spółdzielnia „Jaskółka”. Czynsz ok. 866 zł / 1 os. w tym: zaliczka na ciepłą + zimną wodę, ogrzewanie-MPEC, fundusz remontowy, opłaty administracyjne, itp. Internet światłowodowy z ZETO (48 zł).
Bardzo dobra lokalizacja, wokół rozwinięta infrastruktura, w pobliżu: dworzec PKP, przystanki autobusowe, Lidl, Biedronka, Żabka, kościół, przychodnia, szkoła, przedszkole, tereny rekreacyjne.
Koszt najmu 2000 zł + czynsz do spółdzielni, internet, prąd oraz gaz wg. zużycia. Wymagana kaucja zwrotna w wysokości 2000 zł. Dostępność od 1 kwietnia 2025.",PrywatneZwierzęta: TakWinda: NieParking: przynależne na ulicyPoziom: 1Umeblowane: TakRodzaj zabudowy: BlokPowierzchnia: 44 m²Liczba pokoi: 2 pokojeCzynsz (dodatkowo): 866 zł,https://www.olx.pl/oferta/mieszkanie-2-pokojowe-z-balkonem-jasna-kuchnia-44-m-tarnow-strusina-CID3-ID14FTKf.html?reason=extended_search_extended_distance
