Title,Price,Area,Address,description,table,Link
Wynajmę mieszkanie - ZAREZERWOWANE,1 550 zł,31 m²,Bochnia - 23 marca 2025,brak opisu otodom,brak opisu otodom,https://www.otodom.pl/pl/oferta/wynajme-mieszkanie-zarezerwowane-ID4wzxb.html
Wynajmę mieszkanie,1 500 zł,75 m²,Łapsze Niżne - 16 marca 2025,Mam do wynajęcia domek jednorodzinny z ogrodem i altaną Ciche spokojne miejsce Do dyspozycji 2 pokoje salon i kuchnia łazienka i poddasze.Lokalizacja Łapsze Niżne.Wiecej informacji pod nr tel 51*****32 lub 50*****81,PrywatneZwierzęta: TakWinda: NieParking: parking strzeżonyPoziom: ParterUmeblowane: TakRodzaj zabudowy: Dom wolnostojącyPowierzchnia: 75 m²Liczba pokoi: 2 pokoje,https://www.olx.pl/d/oferta/wynajme-mieszkanie-CID3-ID12gaaW.html?reason=extended_search_extended_distance
Do wynajęcia mieszkanie w centrum Bochni,1 800 zł,40 m²,Bochnia - 06 marca 2025,brak opisu otodom,brak opisu otodom,https://www.otodom.pl/pl/oferta/do-wynajecia-mieszkanie-w-centrum-bochni-ID4whTu.html
Nowe mieszkanie blisko centrum Bochnia,2 200 zł,35 m²,Bochnia - 12 marca 2025,brak opisu otodom,brak opisu otodom,https://www.otodom.pl/pl/oferta/nowe-mieszkanie-blisko-centrum-bochnia-ID4wnoK.html
BOCHNIA ul. Brzeźnicka – nowe mieszkanie do wynajęcia,2 200 zł,43 m²,Bochnia - 24 marca 2025,"BOCHNIA ul. Brzeźnicka – nowe mieszkanie do wynajęcia, mieszkanie o wysokim standardzie

– do wynajęcia nowe mieszkanie z dużym balkonem w nowoczesnym czterokondygnacyjnym budynku mieszkalnym położonym w malowniczej części Bochni, przy ul. Brzeźnickiej o powierzchni 43 m2. Mieszkanie znajduje się na III piętrze. W budynku znajdują się cichobieżne windy.

W skład pomieszczeń wchodzą:
 - pokój dzienny z aneksem kuchennym
 - sypialnia
 - łazienka
 - przedpokój
 - garderoba

Do mieszkania przynależy miejsce postojowe oraz komórka lokatorska. Mieszkanie posiada klimatyzację. Mieszkanie jest w pełni urządzone i wyposażone w sprzęt AGD, meble kuchenne, szafkę rtv, rozkładaną sofa, stolik z krzesłami, szafę, w sypialni łóżko i dodatkowa szafa, w łazience prysznic i pralka.

Bardzo dobry dojazd do Krakowa. Sąsiedztwo apartamentowca stanowią budynki wielorodzinne. W bezpośredniej bliskości znajdują się także: sklep, szkoła, przedszkole.

OPŁATY: cena najmu to 2200 zł/miesiąc + miejsce postojowe 100 zł miesiąc + czynsz administracyjny ok. 650 zł/miesiąc (w cenie czynszu jest zawarta : zaliczka na centralne ogrzewanie, ciepłą i zimną wodę, opłatę za śmieci, oraz koszty administracyjne ). Kaucja zwrotna 3000zł.

Dodatkowe opłaty to prąd według własnego zużycia.

Wynajem długoterminowy.

tel.: 51*****11

Niniejsze ogłoszenie jest wyłącznie informacją handlową i nie stanowi oferty w rozumieniu Kodeksu Cywilnego.",PrywatneZwierzęta: NieWinda: TakParking: przynależne na ulicyPoziom: 3Umeblowane: TakRodzaj zabudowy: ApartamentowiecPowierzchnia: 43 m²Liczba pokoi: 2 pokojeCzynsz (dodatkowo): 650 zł,https://www.olx.pl/d/oferta/bochnia-ul-brzeznicka-nowe-mieszkanie-do-wynajecia-CID3-ID1551OQ.html?reason=extended_search_extended_distance
mieszkanie do wynajęcia,2 200 zł,90 m²,Bochnia - 23 marca 2025,"Opis
Oferuję do wynajęcia mieszkanie po generalnym remoncie, drugie piętro w domu wielorodzinnym, usytuowane w miejscowości Baczków (7 km od Bochni).

Dom składa się z trzech mieszkań, każde z nich posiada osobne i niezależne wejście oraz liczniki zużycia mediów.

W mieszkaniu (ok. 90 m2) znajduje się:
- kuchnia
- salon
- duża sypialnia
- pokój
- łazienka
- klatka schodowa
- dwa balkony

Kuchnia wyposażona jest w nowe, funkcjonalne meble wraz ze sprzętem: płyta indukcyjna, piekarnik, zmywarka, lodówka, okap.
Łazienka z dużą wanną, umywalką, toaletą i lustrem.
Pokoje częściowo umeblowane. Jeśli najemca posiada własne meble, te mogą zostać usunięte.

W mieszkaniu wykonano nową instalację elektryczną, hydrauliczną jak również zastosowano ogrzewanie gazowe (piec 2-funkcyjny) - dzięki czemu użytkowanie mieszkania jest praktycznie bezobsługowe.

Do dyspozycji jest również ogródek na którym można np. rozpalić grilla oraz miejsce postojowe na posesji.

Czynsz najmu: 2500 zł + opłaty według zużycia (prąd, gaz, woda, ścieki, śmieci).

Kaucja zwrotna: jednokrotny czynsz.
Preferujemy osoby niepalące, bez zwierząt.
Wynajem długoterminowy.

Oferta ważna od zaraz.
Więcej informacji udzielę telefonicznie: 6-9-6-4-2-8-2-1-5",PrywatneZwierzęta: NieWinda: NiePoziom: 2Umeblowane: TakRodzaj zabudowy: Dom wolnostojącyPowierzchnia: 90 m²Liczba pokoi: 3 pokoje,https://www.olx.pl/d/oferta/mieszkanie-do-wynajecia-CID3-ID13GOu8.html?reason=extended_search_extended_distance
wynajmę mieszkanie,1 700 zł,30 m²,Bochnia - 20 marca 2025,"Do wynajęcia mieszkanie ok 30 m2, dla jednej osoby  na parterze domu prywatnego. Mieszkanie składa się z pokoju ,łazienki i aneksu kuchennego . Osobne wejście. W cenę wliczone wszystkie opłaty (woda ,ogrzewanie, prąd, śmieci ,internet )  miejsce parkingowe .kaucja 2000 . dogodna lokalizacja ul.Krzeczowska okolica Biedronki .",PrywatneZwierzęta: NieWinda: NieParking: brakPoziom: ParterUmeblowane: TakRodzaj zabudowy: Dom wolnostojącyPowierzchnia: 30 m²Liczba pokoi: Kawalerka,https://www.olx.pl/d/oferta/wynajme-mieszkanie-CID3-ID151a00.html?reason=extended_search_extended_distance
Mieszkanie 2pokojowe ul. Brzeźnicka,2 100 zł,42 m²,Bochnia - 18 marca 2025,"Do wynajęcia mieszkanie 2pokojowe w Bochni przy ulicy Brzeźnickiej o powierzchni 42 mkw. Osobna jasna kuchnia, łazienka. Jest ono wyposażone, gotowe do zamieszkania. Usytuowane na wysokim parterze, posiada balkon. Do lokalu przynależy komórka lokatorska. 

Mieszkanie ogrzewane piecem gazowym dwufunkcyjnym.

Niski czynsz, przy 1 osobie około 220 zł. Odstępne 2100 zł. Wymagana kaucja zwrotna 3500 zł. 
Preferuje osoby bez zwierząt.

Dostępne od 1 kwietnia. Więcej informacji udzielę telefonicznie.",PrywatneZwierzęta: NieWinda: NiePoziom: ParterUmeblowane: TakRodzaj zabudowy: BlokPowierzchnia: 42 m²Liczba pokoi: 2 pokoje,https://www.olx.pl/d/oferta/mieszkanie-2pokojowe-ul-brzeznicka-CID3-ID14Za52.html?reason=extended_search_extended_distance
Wynajmę połowę mieszkania  w centrum bochni 54m,1 200 zł,54 m²,Bochnia - Odświeżono dnia 18 marca 2025,Szukam współlokatora w centrum bochni. Mieszkanie ma 54m. Więcej informacji udzielę telefonicznie,FirmoweZwierzęta: TakWinda: NieParking: w garażuPoziom: 2Umeblowane: TakRodzaj zabudowy: ApartamentowiecPowierzchnia: 54 m²Liczba pokoi: 3 pokoje,https://www.olx.pl/d/oferta/wynajme-polowe-mieszkania-w-centrum-bochni-54m-CID3-ID14Ptzk.html?reason=extended_search_extended_distance
2 pokojowe mieszkanie na ul. Św Leonarda tuż obok Dworca PKP,1 800 zł,37 m²,Bochnia - Odświeżono dnia 18 marca 2025,"Witam.

Do wynajęcia dwupokojowe mieszkanie zlokalizowane na 2 piętrze  bloku przy ul. Św Leonarda.

Mieszkanie w pełni umeblowane i wyposażone. W 2023 roku przeszło gruntowny remont. Do dyspozycji komórka lokatorska.
Na osiedlu ogólnodostępne miejsca parkingowe. 

Blok znajduje się obok Basenu i sklepu Lidl. 

Opłaty:
1800zl + Czynsz administracyjny (przy 2 osobach około 650 zl - w tym woda, ogrzewanie, opłata za wywóz śmieci) + Media według zużycia(prąd i gaz).

Mieszkanie dostępne od Kwietnia. Kaucja w wysokości 2500zl.

Zapraszam do kontaktu.
Kamil",PrywatneZwierzęta: NieWinda: NiePoziom: 2Umeblowane: TakRodzaj zabudowy: BlokPowierzchnia: 37 m²Liczba pokoi: 2 pokoje,https://www.olx.pl/d/oferta/2-pokojowe-mieszkanie-na-ul-sw-leonarda-tuz-obok-dworca-pkp-CID3-ID14NP1Q.html?reason=extended_search_extended_distance
Do wynajęcia mieszkanie na poddaszu przy ul. Brzeźnickiej w Bochni,2 000 zł,52 m²,Bochnia - 17 marca 2025,"Oferujemy do wynajęcia mieszkanie o powierzchni użytkowej 52 m², usytuowane na poddaszu jednego z pierwszych budynków na Osiedlu Panorama. 
Lokal składa się z sypialni, aneksu kuchennego, łazienki oraz przedpokoju. 
Mieszkanie nie posiada windy, jednak klatki schodowe są szerokie.

Ogrzewanie zapewnia piec gazowy dwufunkcyjny.

Lokal znajduje się w odległości około 1,5 km od centrum Bochni, co gwarantuje dogodny dostęp do sklepów, restauracji, placówek edukacyjnych oraz innych udogodnień. 
Okolica jest cicha, pełna zieleni, a z okien rozciąga się przepiękny widok na panoramę miasta, który zachwyca o każdej porze roku.

Do mieszkania przynależy piwnica.

Warunki wynajmu:
Czynsz najmu: 2 000 zł
Opłata do wspólnoty mieszkaniowej: 250 zł
Media: płatne według zużycia

Wymagana umowa najmu okazjonalnego.
Kaucja: 2 500 zł.

Zapraszam do kontaktu w celu uzyskania szczegółowych informacji.",FirmoweWinda: NiePoziom: 4Umeblowane: TakRodzaj zabudowy: ApartamentowiecPowierzchnia: 52 m²Liczba pokoi: 2 pokojeCzynsz (dodatkowo): 250 zł,https://www.olx.pl/d/oferta/do-wynajecia-mieszkanie-na-poddaszu-przy-ul-brzeznickiej-w-bochni-CID3-ID14Y1bt.html?reason=extended_search_extended_distance
Mieszkanie Kraków kawalerka,2 500 zł,27 m²,Bochnia - 12 marca 2025,"Nowe, niezamieszkałe mieszkanie-kawalerka.
28m2 
Łazienka , holl, salon z aneksem .
 Duży balkon 7m2 . 

uL. Piaskowa 9
Osiedle ""Cube""

Świetna lokalizacja !

III PIERO . Budynek trzypiętrowy.
Parking podziemny dla jednego auta. 
Winda

Cena: 
2500 plus opłaty . 

Nowiutkie osiedle. 
Ba dużo dobra lokalizacja .

KAWALERKA DOSTĘPNA OD KONCA KWIETNIA LUB PIERWSZE DNI MAJA .","PrywatneZwierzęta: NieWinda: TakParking: w garażu, parking strzeżonyPoziom: 3Umeblowane: TakRodzaj zabudowy: ApartamentowiecPowierzchnia: 27 m²Liczba pokoi: KawalerkaCzynsz (dodatkowo): 360 zł",https://www.olx.pl/d/oferta/mieszkanie-krakow-kawalerka-CID3-ID14SOfV.html?reason=extended_search_extended_distance
Kawalerka na wynajem centrum Bochni lokal mieszkanie do wynajęcia,1 500 zł,30 m²,Bochnia - 10 marca 2025,"Kawalerka na wynajem w centrum Bochni
Cena najmu miesięcznego 1500 zl plus media (woda, prąd, śmieci, gaz, internet) brak dodatkowego czynszu administracyjnego. 
Kawalerka znajduje sie w kamienicy na pierwszym piętrze. Parking dla jednego samochodu w cenie najmu.",PrywatneZwierzęta: NieWinda: NieParking: parking strzeżonyPoziom: 1Umeblowane: TakRodzaj zabudowy: KamienicaPowierzchnia: 30 m²Liczba pokoi: KawalerkaCzynsz (dodatkowo): 1 zł,https://www.olx.pl/d/oferta/kawalerka-na-wynajem-centrum-bochni-lokal-mieszkanie-do-wynajecia-CID3-ID14Qvkp.html?reason=extended_search_extended_distance
Mieszkanie do wynajęcia,1 550 zł,47 m²,Bochnia - 08 marca 2025,"Dzień dobry, 
do wynajęcia mieszkanie:

- w Bochni przy ul. Kolejowej
- dwupokojowe o powierzchni 47 m2
- umeblowana kuchnia
- kwota najmu – 1 550 zł
- kwota czynszu do spółdzielni – 550 zł / przy 2 os. 
- media zgodnie ze zużyciem
- kaucja – 3000 zł 

Przed połączeniem telefonicznym proszę wysłać wiadomość SMS.",PrywatneZwierzęta: NieWinda: NieParking: przynależne na ulicyPoziom: 4Umeblowane: NieRodzaj zabudowy: BlokPowierzchnia: 47 m²Liczba pokoi: 2 pokojeCzynsz (dodatkowo): 574 zł,https://www.olx.pl/d/oferta/mieszkanie-do-wynajecia-CID3-ID14eaiU.html?reason=extended_search_extended_distance
do wynajęcia mieszkanie jednopokojowe 36 m2,450 zł,36 m²,Bochnia - 05 marca 2025,"Mieszkanie jednopokojowe + kuchnia + łazienka 36 m2, ul. Oracka, Bochnia. Opłaty 450 zł + media (woda, prąd, gaz, śmieci).",PrywatneZwierzęta: NieWinda: NieParking: brakPoziom: ParterUmeblowane: NieRodzaj zabudowy: KamienicaPowierzchnia: 36 m²Liczba pokoi: KawalerkaCzynsz (dodatkowo): 450 zł,https://www.olx.pl/d/oferta/do-wynajecia-mieszkanie-jednopokojowe-36-m2-CID3-ID14LfRo.html?reason=extended_search_extended_distance
Wynajem mieszkania,2 400 złdo negocjacji,45 m²,Bochnia - 03 marca 2025,"Nowe, dwupokojowe mieszkanie z ogródkiem i miejscem parkingowym o powierzchni 45 m^2. Czynsz 200 zł.",PrywatneZwierzęta: TakWinda: NieParking: parking strzeżonyPoziom: ParterUmeblowane: TakRodzaj zabudowy: BlokPowierzchnia: 45 m²Liczba pokoi: 2 pokojeCzynsz (dodatkowo): 200 zł,https://www.olx.pl/d/oferta/wynajem-mieszkania-CID3-ID14JyTy.html?reason=extended_search_extended_distance
"Bochnia KAWALERKA z balkonem do wynajęcia 26,90 m2, Winda, Nowy blok",1 600 zł,27 m²,Bochnia - 02 marca 2025,"Opis oferty

Bochnia KAWALERKA z balkonem do wynajęcia 26,90 m2

– do wynajęcia mieszkanie jednopokojowe usytuowane na I piętrze z balkonem. Powierzchnia użytkowa mieszkania to 26,90 m2 w nowoczesnym budynku mieszkalnym położonym przy ul. św. Jana – około 7 minut piechotą do Rynku.

Mieszkanie częściowo umeblowane, płyta indukcyjna, lodówka, pochłaniacz; w łazience prysznic, pralka; na podłogach panele i płytki. 

W budynku znajdują się cichobieżne windy. Ogrzewanie i ciepła woda z MPEC.

Znakomita lokalizacja, blisko centrum miasta ok. 700 m oraz bardzo dobry dostęp do drogi krajowej E40 (1 km). Sąsiedztwo apartamentowca stanowią budynki wielorodzinne i usługowe. W bezpośredniej bliskości znajdują się także: kościół, szkoła i przedszkole.

Cena najmu to 1600zl / miesiąc + CZYNSZ ADMINISTRACYJNY w wysokości 262,00 zł (w tym: zaliczka na centralne ogrzewanie, ciepłą i zimną wodę oraz opłata za wywóz śmieci).

Czynsz administracyjny przy 1 osobie wynosi: 262,00 zł

Czynsz administracyjny przy 2 osobach wynosi: 350,88 zł

Dodatkowe opłaty to: prąd według własnego zużycia.

MIESZKANIE DOSTĘPNE OD 01.03.2025 R.

GORĄCO POLECAMY I ZAPRASZAMY DO BEZPŁATNEJ PREZENTACJI NIERUCHOMOŚCI.

KANCELARIA NIERUCHOMOŚCI DOROTA KUKLIŃSKA (nr licencji 18408)

tel.: 51*****98, 53*****65

Bezpłatnie pomagamy w doborze i formalnościach związanych z uzyskaniem kredytu na zakup wybranej nieruchomości.

Zapraszamy na stronę Naszego biura:

Niniejsze ogłoszenie jest wyłącznie informacją handlową i nie stanowi oferty w rozumieniu Kodeksu Cywilnego.",PrywatneZwierzęta: NieWinda: TakPoziom: 4Umeblowane: TakRodzaj zabudowy: BlokPowierzchnia: 27 m²Liczba pokoi: KawalerkaCzynsz (dodatkowo): 262 zł,https://www.olx.pl/d/oferta/bochnia-kawalerka-z-balkonem-do-wynajecia-26-90-m2-winda-nowy-blok-CID3-IDH7U4o.html?reason=extended_search_extended_distance
Nowe mieszkanie z ogrzewaniem w cenie bezczynszowe BOCHNIA 55m2,2 650 zł,55 m²,Bochnia - 27 lutego 2025,"Wynajmę nowe mieszkanie w Bochni 1000 m do rynku (15 min pieszo) wysoki standard. W pełni umeblowane i wyposażone. 
Mieszkanie składa się z:
- wiatrołapu ( szafa na ubrania i buty)
- przedpokoju
- łazienki ( prysznic, pralka, ręcznikowiec kaloryfer, dodatkowo ogrzewanie podłogi, szafka na kosmetyki)
- salon ( narożnik, meblościanka, telewizor, router na internet, stół + 4 krzesła, klimatyzacja
- pokój ( dwuosobowa kanapa rozkładana, komoda, telewizor)
Duża szafa szklana przesuwna ( odkurzacz, deska do prasowania, suszarka na ubrania)
- kuchnia ( piekarnik, płyta, czajnik, lodówka oraz pełne wyposażenie garnki, talerze, szklanki, sztućce itp.)

Cena za wynajem 55 m2 2650 zł w cenie ogrzewanie mieszkania. Kaucja 3000 zł. Opłaty za śmieci oraz za wodę i prąd według zużycia. Miejsce postojowe na terenie zamkniętym w cenie.
Udogodnienia: klimatyzacja, internet. Mieszkanie dostępne od zaraz. Zapraszam na oglądnięcie.
Więcej informacji pod nr tel. 51*****96",PrywatneZwierzęta: NieWinda: NieParking: parking strzeżonyPoziom: 1Umeblowane: TakRodzaj zabudowy: Dom wolnostojącyPowierzchnia: 55 m²Liczba pokoi: 2 pokoje,https://www.olx.pl/d/oferta/nowe-mieszkanie-z-ogrzewaniem-w-cenie-bezczynszowe-bochnia-55m2-CID3-ID149LPs.html?reason=extended_search_extended_distance
"Bochnia, ul. Brzeźnicka mieszkanie 45 mkw z ogródkiem - do wynajęcia",1 850 zł,45 m²,Bochnia - 26 lutego 2025,"Do wynajęcia przytulne i funkcjonalne mieszkanie na parterze z własnym ogródkiem, 
idealne dla rodzin, seniorów lub osób szukających komfortu w dobrej lokalizacji.

Parter – wygodne wejście, bez schodów
Prywatny ogródek – doskonały na odpoczynek i spotkania na świeżym powietrzu
Komórka lokatorska – dodatkowe miejsce na przechowywanie
Blisko centrum – świetna lokalizacja, wszystko w zasięgu ręki
Plac zabaw w pobliżu – idealne rozwiązanie dla rodzin z dziećmi
Dobra komunikacja – szybki dostęp do transportu miejskiego i infrastruktury

Mieszkanie jest zadbane i gotowe do zamieszkania od zaraz. 
Zapraszam do kontaktu i obejrzenia

Cena najmu 1950 zł + czynsz administracyjny ok. 750 zł + prąd",FirmoweZwierzęta: NiePoziom: ParterUmeblowane: TakRodzaj zabudowy: BlokPowierzchnia: 45 m²Liczba pokoi: 2 pokojeCzynsz (dodatkowo): 750 zł,https://www.olx.pl/d/oferta/bochnia-ul-brzeznicka-mieszkanie-45-mkw-z-ogrodkiem-do-wynajecia-CID3-ID14F0cE.html?reason=extended_search_extended_distance
Wynajmę mieszkanie z ogrodem,3 000 zł,53 m²,Bochnia - 26 lutego 2025,"Wynajmę od zaraz zamieszkanie o powierzchni 53m2, znajdujace się na parterze czteromieszkaniowego budynku znajdujące się w miejscowości  Bochnia, ul. Myśliwska. 

W skład mieszkania wchodzi:
-wiatrolap, wraz z szafą
-korytarz z wnęka,
-sypialnia, wraz z łóżkiem i szafą
-pokój, wraz z meblami i rozkładana sofa pojedyńczą
- łazienka, wraz z wanną i bateria prysznicowa, szafka, pralką
-kuchnia z wyspą, wraz z lodówką, płyta indukcyjną, piekarnikiem, okapem i zmywarką 60 cm
-salon, wraz z meblami i rozkładana sofą.

Do mieszkania przynależy ogródek z bezpośrednim wyjściem z salonu przez przesówne drzwi z widokiem na las, który idealnie nadaje się do zabawy dla dzieci lub odpoczynku przy kawie w towarzystwie natury 

Dodatkowym atutem są rolety zewnętrzne antywłamaniowe znajdujące się we wszystkich oknach budynku.

Do mieszkania należy też miejsce parkingowe bezpośrednio przy budynku. 

Osiedle jest małe i kameralne, gdzie przeważają domki jednorodzinne. Cisza, spokój i niewielka liczba mieszkańców. Teren osiedla jest całościowo ogrodzony i dostępny wyłącznie dla mieszkańców, a brama otwierana jest na pilota.

Na całości mieszkania jest zainstalowane ogrzewa nie podłogowe co zwiększa estetykę, przestrzeń i wydajność grzewczą. Lokal i ciepła woda użytkowa ogrzewane są przy pomocy kotła gazowego znajdującego się w łazience.

Mieszkanie posiada wejścia telewizyjne i internetowe.

Media rozliczane są zgodnie ze zużyciem.

Mieszkanie jest dostępne od 1 lutego. 

Jeśli szukasz spokojnego miejsca do zamieszkania, gdzie czujesz się jak w domu i możesz uciec od codziennego zgiełku miejskiego oraz wypoczynku po pracy lub potrzebujesz przestrzeni do zabawy dla swoich pociech to zapraszamy do kontaktu i umówienia się na oglądanie mieszkania. 

Cena wynajmu podlega negocjacji ;)",PrywatneZwierzęta: NieWinda: NiePoziom: ParterUmeblowane: TakRodzaj zabudowy: Dom wolnostojącyPowierzchnia: 53 m²Liczba pokoi: 3 pokojeCzynsz (dodatkowo): 200 zł,https://www.olx.pl/d/oferta/wynajme-mieszkanie-z-ogrodem-CID3-ID149ojX.html?reason=extended_search_extended_distance
"Do wynajęcia mieszanie 40m2, Bochnia ul.Brzeźnicka",1 900 zł,40 m²,Bochnia - 26 lutego 2025,"Nowoczesne mieszkanie 40m², Bochnia ul. Brzeźnicka 55G
Mieszkanie usytuowane jest na II piętrze, 2-pokojowe umeblowane, z klimatyzacją. 
Mieszkanie posiada garaż, miejsce parkingowe, balkon i komórkę lokatorską w cenie wynajmu.
W budynku jest domofon oraz winda.

Opis mieszkania:
Łazienka: prysznic, toaleta, umywalka
Sypialnia: łóżko 160cm z materacem, szafa zabudowa-garderoba.
Przedpokój: przestronna szafa, oszklona ścianka działowa
Salon z aneksem kuchennym:
Wyposażenie salonu: kanapa (nierozkładana), 3 krzesła, stolik 
Aneks kuchenny: zmywarka, lodówka, piekarnik, płyta indukcyjna,  okap, pralka.

Pozostałe informacje:
Dostępne: od 1-go marca 2025
Wynajem (odstępne): 1900 PLN/miesiąc.
Kaucja zwrotna: 1900 PLN
Czynsz administracyjny: 900PLN /miesiąc (zawiera zaliczki na ogrzewanie, wodę, śmieci i inne, wysokość zależna również od zużycia)
Energia elektryczna: płatna co 2-miesiąc według wskazań licznika.

Wyłącznie najem długoterminowy (minimum rok). 
W wynajmowanym mieszkaniu nie są akceptowane zwierzęta.

Zapraszamy do kontaktu i obejrzenia mieszkania, proszę dzwonić po godzinie 18.00",PrywatneZwierzęta: NieWinda: TakParking: w garażuPoziom: 2Umeblowane: TakRodzaj zabudowy: BlokPowierzchnia: 40 m²Liczba pokoi: 2 pokojeCzynsz (dodatkowo): 900 zł,https://www.olx.pl/d/oferta/do-wynajecia-mieszanie-40m2-bochnia-ul-brzeznicka-CID3-ID149h4i.html?reason=extended_search_extended_distance
Mieszkanie na wynajem,1 500 zł,"37,70 m²",Bochnia - 26 lutego 2025,"Do wynajęcia mieszkanie na osiedlu Jana w Bochnia o powierzchni 37,7m składające się z:
2 pokoi, oddzielnej kuchni z oknem, łazienki. 
W przedpokoju szafa w zabudowie. 
Pokoje i kuchnia umeblowane. Sprzęt AGD(piekarnik, kuchenka gazowo-elektryczna, lodówka, pralka).

Mieszkanie znajduje się na parterze.
Do mieszkania przynależy komórka lokatorska. 

W pobliżu duży market spożywczy, cukiernia, piekarnia, przedszkole, kościół, przychodnia. Bardzo blisko centrum miasta. 

Warunki wynajmu:

Oferta dla osób niepalących bez zwierząt.

Cena wynajmu 1500 zł
Czynsz administracyjny z centralnym ogrzewaniem  dla 1 osoby wynosi 320zł(bez zużycia wody zimnej i ciepłej, oraz śmieci). 
Opłata za czynsz przy jednej osobie z wszystkimi mediami tzn. woda śmieci i fundusz remontowy wynoszą łącznie 480zł. 

Gaz i prąd płatne według zużycia. 
Umowę z Tauron i PGNiG Najemca podpisuje indywidualnie. 

Minimalny okres wynajmu 1 rok.
Obowiązuje miesięczny okres wypowiedzenia.

Kaucja 2000zł płatna w dniu podpisania umowy najmu.
Wynajem tylko na zasadzie NAJMU OKAZJONALNEGO (umowa podpisywana u notariusza, konieczność podania alternatywnego miejsca zamieszkania z pisemnym potwierdzeniem właściciela).

Mieszkanie dostępne od 1.04. 2025
Telefon: 51*****44","PrywatneZwierzęta: NieWinda: NiePoziom: ParterUmeblowane: TakRodzaj zabudowy: BlokPowierzchnia: 37,70 m²Liczba pokoi: 2 pokojeCzynsz (dodatkowo): 480 zł",https://www.olx.pl/d/oferta/mieszkanie-na-wynajem-CID3-ID14EkDd.html?reason=extended_search_extended_distance
Kawalerka w Bochni - wynajem,1 600 zł,28 m²,Bochnia - 25 lutego 2025,"Umeblowana kawalerka z osobnym aneksem kuchennym .

Mieszkanie składa się z :

Pokoju dziennego ( szafa, regał, kanapa)
Aneks kuchenny ( aneks kuchenny w pełni wyposażony w AGD  )
Łazienka ( w pełni wyposażona wraz z pralką ).

Ogrzewanie : PIEC DWUFUNKCYJNY

Mieszkanie  posiada bardzo duży balkon .
Znajduję się na IV piętrze, w bloku jest winda.
Do mieszkania przynależy strych oraz miejsce parkingowe.

Kaucja : 2 000,00 zł płatna w dniu podpisania umowy najmu.

Czynsz administracyjny : w cenie wynajmu.

Gaz i prąd : najemca podpisuje indywidualnie umowę z TAURON i PGNIG .
Woda rozliczana raz na 6 miesięcy, według wskazań wodomierza. 

Umowa najmu podpisywana na 12 miesięcy. Obowiązuje miesięczny okres wypowiedzenia. Minimalny okres najmu to 6 miesięcy .

Mieszkanie dostępne od zaraz . 
Adres : Bochnia, ul. Brzeźnicka 55 F.

Możliwość obejrzenia od poniedziałku do piątku w godzinach",FirmoweZwierzęta: TakWinda: TakParking: przynależne na ulicyPoziom: 5Umeblowane: TakRodzaj zabudowy: BlokPowierzchnia: 28 m²Liczba pokoi: Kawalerka,https://www.olx.pl/d/oferta/kawalerka-w-bochni-wynajem-CID3-ID14Dpf2.html?reason=extended_search_extended_distance
"NOWE STUDIO z ogródkiem Campi KN2, 33m2",1 900 zł,33 m²,Bochnia - 04 marca 2025,brak opisu otodom,brak opisu otodom,https://www.otodom.pl/pl/oferta/nowe-studio-z-ogrodkiem-campi-kn2-33m2-ID4weSD.html
3-pok | ogród | Bochnia-Łapczyca,2 200 zł,50 m²,Bochnia - 21 marca 2025,brak opisu otodom,brak opisu otodom,https://www.otodom.pl/pl/oferta/3-pok-ogrod-bochnia-lapczyca-ID4wyfM.html
Wynajmę mieszkanie,1 300 zł,39 m²,Mokrzyska - 05 marca 2025,"Witam. Od kwietnia zwalnia się mieszkanie na wynajem w Brzesku przy ul. Browarnej wysoki parter. Mieszkanie ma 39mk i sklada sie z jednego duzego pokoju dużej kuchni i łazienki. Do mieszkania przynależy również piwnica. Koszt to 1300zł odstępne plus 700zł czynsz,  dodatkowo prąd i gaz ok. 200zł  centralne ogrzewanie rozliczane po sezonie i 2razy  w roku rozliczana również woda. Parking ogólnodostępny.  Kaucja zwrotna 2000zł",PrywatneWinda: NieParking: brakPoziom: ParterUmeblowane: TakRodzaj zabudowy: BlokPowierzchnia: 39 m²Liczba pokoi: KawalerkaCzynsz (dodatkowo): 700 zł,https://www.olx.pl/d/oferta/wynajme-mieszkanie-CID3-ID14L7Em.html?reason=extended_search_extended_distance
Wynajmę mieszkanie 60m² Mszana Dolna,2 400 zł,60 m²,Mszana Dolna - 24 lutego 2025,Wynajmę przestronne nowe mieszkanie 60m² z balkonem  2 pokoje salon otwarty na kuchnię łazienka prysznic niezależne ogrzewanie piec gazowy własny licznik prąd woda gaz,"PrywatneZwierzęta: NieParking: w garażu, przynależne na ulicyPoziom: 1Umeblowane: TakRodzaj zabudowy: Dom wolnostojącyPowierzchnia: 60 m²Liczba pokoi: 3 pokojeCzynsz (dodatkowo): 300 zł",https://www.olx.pl/d/oferta/wynajme-mieszkanie-60m-mszana-dolna-CID3-ID14CEcH.html?reason=extended_search_extended_distance
Przytulne mieszkanie na wynajem,2 300 zł,38 m²,Borek - 17 marca 2025,"Wszystkie informacje odnośnie mieszkania znajdują się pod linkiem : 

https://kaszubnieruchomosci.pl/mieszkanie-wynajem-38m2-2300pln-zary-lubuskie,59/15585/OMW

Osoba do kontaktu: Izabela 57*******06
Zapraszamy do kontaktu.",PrywatneWinda: NiePoziom: 1Umeblowane: TakRodzaj zabudowy: BlokPowierzchnia: 38 m²Liczba pokoi: 2 pokoje,https://www.olx.pl/oferta/przytulne-mieszkanie-na-wynajem-CID3-ID14XwBR.html?reason=extended_search_extended_distance
